{
  "schemaVersion": "0.1",
  "cardId": "deiveek",
  "createdAt": "2026-02-07T00:00:00Z",
  "submittedAt": null,
  "approvedAt": null,
  "phase": "authoring",
  "name": {
    "raw": "Deiveek",
    "display": "Deiveek"
  },
  "pronunciation": {
    "autoSyllables": ["DAY", "VEEK"],
    "finalSyllables": ["DAY", "vik"],
    "ipa": "ˈdeɪ.viːk",
    "plainGuidance": "Like David with a “K” instead of “D”"
  },
  "tts": {
    "engine": "web-speech-api",
    "voice": {
      "label": "Windows Default (example)",
      "voiceURI": null,
      "lang": "en-US",
      "localService": true
    },
    "payload": "DAY, vik. Day-vik",
    "notes": "Phase 0 uses punctuation to encode dual-pass pronunciation in a single utterance."
  },
  "recording": {
    "hasRecording": false,
    "audioFile": null,
    "format": null,
    "durationMs": null
  },
  "moderation": {
    "status": "draft",
    "reviewNotes": null
  },
  "provenance": {
    "createdWith": "TRU-Pronounce Runtime App",
    "appVersion": "0.0.1",
    "device": "unknown",
    "userSubmitted": false
  }
}
